{
  "schema_version": 1,
  "request_id": "0f8b6d5e-2a41-4c3b-9e7d-1a2b3c4d5e6f",
  "operation": "upgrade",
  "status": "succeeded",
  "version": "0.2.0",
  "supervisorRunning": true,
  "runtimes": [
    {
      "bindingId": "ws_example",
      "running": true
    }
  ],
  "protocol": "coforge-installer/v1",
  "exit_code": 0,
  "installer_version": "0.1.0"
}
